{
  "canAim": true,
  "castingDuration": 0.5,
  "chance": 1.0,
  "damage": 1.5,
  "delay": 0.5,
  "description": {
    "ar": "ثوران من أعمدة مشتعلة <color=#f79502>تحرق</color> الأعداء عند تلقي ضربة.",
    "de": "Hervorbrechende Flammensäulen, die getroffene Gegner <color=#f79502>verbrennen</color>.",
    "en": "An eruption of flaming pillars that <color=#f79502>burns</color> enemies on hit.",
    "es": "Una erupción de pilares de fuego que <color=#f79502>queman</color> a los enemigos que golpean.",
    "fr": "Des piliers de flammes qui <color=#f79502>brûlent</color> les ennemis.",
    "fr-CA": "Des piliers de flammes qui <color=#f79502>brûlent</color> les ennemis.",
    "it": "Un'eruzione di colonne infuocate che <color=#f79502>incendiano</color> i nemici al tocco.",
    "ja": "炎の柱を地面から召喚し、命中した敵を<color=#f79502>炎上</color>状態にする。",
    "ko": "적들을 맞출 시 <color=#f79502>불태워 버리는</color> 불기둥을 분출시킵니다.",
    "nl": "Een uitbarsting van brandende pilaren die vijanden <color=#f79502>verbrandt</color> wanneer je ze raakt.",
    "pt-BR": "Uma erupção de pilares de fogo que <color=#f79502>queima</color> os inimigos ao acertá-los.",
    "ru": "Вы поднимаете из земли столпы пламени, которые <color=#f79502>поджигают</color> задетых врагов.",
    "tr": "Düşmanları isabet hâlinde <color=#f79502>yakan</color> bir alev sütunu patlaması.",
    "zh-CN": "猛烈迸发出火柱，击中敌人时使敌人<color=#f79502>燃烧</color>。",
    "zh-TW": "猛烈迸發出火柱，擊中敵人時使敵人<color=#f79502>燃燒</color>。"
  },
  "descriptionPlain": {
    "ar": "ثوران من أعمدة مشتعلة تحرق الأعداء عند تلقي ضربة.",
    "de": "Hervorbrechende Flammensäulen, die getroffene Gegner verbrennen.",
    "en": "An eruption of flaming pillars that burns enemies on hit.",
    "es": "Una erupción de pilares de fuego que queman a los enemigos que golpean.",
    "fr": "Des piliers de flammes qui brûlent les ennemis.",
    "fr-CA": "Des piliers de flammes qui brûlent les ennemis.",
    "it": "Un'eruzione di colonne infuocate che incendiano i nemici al tocco.",
    "ja": "炎の柱を地面から召喚し、命中した敵を炎上状態にする。",
    "ko": "적들을 맞출 시 불태워 버리는 불기둥을 분출시킵니다.",
    "nl": "Een uitbarsting van brandende pilaren die vijanden verbrandt wanneer je ze raakt.",
    "pt-BR": "Uma erupção de pilares de fogo que queima os inimigos ao acertá-los.",
    "ru": "Вы поднимаете из земли столпы пламени, которые поджигают задетых врагов.",
    "tr": "Düşmanları isabet hâlinde yakan bir alev sütunu patlaması.",
    "zh-CN": "猛烈迸发出火柱，击中敌人时使敌人燃烧。",
    "zh-TW": "猛烈迸發出火柱，擊中敵人時使敵人燃燒。"
  },
  "family": "Tentacles",
  "icon": "icons/curses/Tentacles_Flame.png",
  "id": "Tentacles_Flame",
  "lore": {
    "ar": "سلف الجفاف العظيم.",
    "de": "Vorläufer der großen Dürre.",
    "en": "Predecessor to the Great Drought.",
    "es": "Predecesor de la Gran Sequía.",
    "fr": "Prédécesseur de la grande sécheresse.",
    "fr-CA": "Prédécesseur de la grande sécheresse.",
    "it": "Il precursore della Grande Siccità.",
    "ja": "大干ばつをもたらしたもの。",
    "ko": "대가뭄의 전조.",
    "nl": "Voorganger van de grote droogte.",
    "pt-BR": "Antecedente da Grande Seca.",
    "ru": "Грядёт великая засуха.",
    "tr": "Büyük Kuraklık'ın sebebi.",
    "zh-CN": "大旱灾的原身。",
    "zh-TW": "大旱災的原身。"
  },
  "name": {
    "ar": "لمسة ييغ",
    "de": "Yigs Berührung",
    "en": "Touch of Yig",
    "es": "Toque de Yig",
    "fr": "Souvenir de Yig",
    "fr-CA": "Souvenir de Yig",
    "it": "Tocco di Yig",
    "ja": "イグの御手",
    "ko": "이그의 손길",
    "nl": "Aanraking van Yig",
    "pt-BR": "Toque de Yig",
    "ru": "Касание Йига",
    "tr": "Yig'in Dokunuşu",
    "zh-CN": "伊格之触",
    "zh-TW": "伊格之觸"
  },
  "namePlain": {
    "ar": "لمسة ييغ",
    "de": "Yigs Berührung",
    "en": "Touch of Yig",
    "es": "Toque de Yig",
    "fr": "Souvenir de Yig",
    "fr-CA": "Souvenir de Yig",
    "it": "Tocco di Yig",
    "ja": "イグの御手",
    "ko": "이그의 손길",
    "nl": "Aanraking van Yig",
    "pt-BR": "Toque de Yig",
    "ru": "Касание Йига",
    "tr": "Yig'in Dokunuşu",
    "zh-CN": "伊格之触",
    "zh-TW": "伊格之觸"
  },
  "thumb": "icons/curses/64/Tentacles_Flame.png"
}
