{
  "canAim": true,
  "castingDuration": 0.5,
  "chance": 1.0,
  "damage": 1.0,
  "delay": 0.5,
  "description": {
    "ar": "تطلق عدة قذائف تستهدف الأعداء.",
    "de": "Verschießt mehrere Projektile, die Gegner verfolgen.",
    "en": "Shoots multiple projectiles that seek out enemies.",
    "es": "Dispara varios proyectiles que persiguen a los enemigos.",
    "fr": "Tire plusieurs projectiles qui pourchassent les ennemis.",
    "fr-CA": "Tire plusieurs projectiles qui pourchassent les ennemis.",
    "it": "Spara molteplici proiettili che cercano i nemici.",
    "ja": "敵を追跡する弾を複数射出する。",
    "ko": "적들을 찾아다니는 투사체를 다수 발사합니다.",
    "nl": "Schiet meerdere projectielen af die automatisch op vijanden afgaan.",
    "pt-BR": "Dispara diversos projéteis que procuram inimigos.",
    "ru": "Вы выпускаете множество снарядов, наводящихся на врагов.",
    "tr": "Düşmanları takip eden birden fazla menzilli saldırı yapar.",
    "zh-CN": "射出追踪敌人的数个投射物。",
    "zh-TW": "射出追蹤敵人的數個投射物。"
  },
  "descriptionPlain": {
    "ar": "تطلق عدة قذائف تستهدف الأعداء.",
    "de": "Verschießt mehrere Projektile, die Gegner verfolgen.",
    "en": "Shoots multiple projectiles that seek out enemies.",
    "es": "Dispara varios proyectiles que persiguen a los enemigos.",
    "fr": "Tire plusieurs projectiles qui pourchassent les ennemis.",
    "fr-CA": "Tire plusieurs projectiles qui pourchassent les ennemis.",
    "it": "Spara molteplici proiettili che cercano i nemici.",
    "ja": "敵を追跡する弾を複数射出する。",
    "ko": "적들을 찾아다니는 투사체를 다수 발사합니다.",
    "nl": "Schiet meerdere projectielen af die automatisch op vijanden afgaan.",
    "pt-BR": "Dispara diversos projéteis que procuram inimigos.",
    "ru": "Вы выпускаете множество снарядов, наводящихся на врагов.",
    "tr": "Düşmanları takip eden birden fazla menzilli saldırı yapar.",
    "zh-CN": "射出追踪敌人的数个投射物。",
    "zh-TW": "射出追蹤敵人的數個投射物。"
  },
  "family": "Fireball",
  "icon": "icons/curses/Fireball_Swarm.png",
  "id": "Fireball_Swarm",
  "lore": {
    "ar": "تبحث عمن يجرؤون على الشك وتضربهم.",
    "de": "Jage all jene, die es wagen, zu zweifeln.",
    "en": "Seek and strike those who dare doubt.",
    "es": "Busca y castiga a aquellos invadidos por la duda.",
    "fr": "Traquez et punissez les mécréants.",
    "fr-CA": "Traquez et punissez les mécréants.",
    "it": "Cerca e colpisci chiunque osi dubitare.",
    "ja": "愚かにも疑う者を見つけ出し、迫害せよ。",
    "ko": "감히 의심하는 자들을 찾아 공격한다.",
    "nl": "Zoek hen die twijfelen en sla ze neer.",
    "pt-BR": "Procuram e acertam aqueles que ousam duvidar.",
    "ru": "Ищите и карайте тех, кто смеет сомневаться.",
    "tr": "Hikmetinden sual edenleri cezalandır.",
    "zh-CN": "找出胆敢质疑者并加以打击。",
    "zh-TW": "找出膽敢質疑者並加以打擊。"
  },
  "name": {
    "ar": "ملاحقة القدر",
    "de": "Hunde des Schicksals",
    "en": "Hounds of Fate",
    "es": "Sabuesos del destino",
    "fr": "Traque mortelle",
    "fr-CA": "Traque mortelle",
    "it": "Segugi del fato",
    "ja": "運命の猟犬",
    "ko": "운명의 사냥개",
    "nl": "Helhonden van het lot",
    "pt-BR": "Caçadores do Destino",
    "ru": "Псы рока",
    "tr": "Kaderin Tazıları",
    "zh-CN": "命运猎犬",
    "zh-TW": "命運獵犬"
  },
  "namePlain": {
    "ar": "ملاحقة القدر",
    "de": "Hunde des Schicksals",
    "en": "Hounds of Fate",
    "es": "Sabuesos del destino",
    "fr": "Traque mortelle",
    "fr-CA": "Traque mortelle",
    "it": "Segugi del fato",
    "ja": "運命の猟犬",
    "ko": "운명의 사냥개",
    "nl": "Helhonden van het lot",
    "pt-BR": "Caçadores do Destino",
    "ru": "Псы рока",
    "tr": "Kaderin Tazıları",
    "zh-CN": "命运猎犬",
    "zh-TW": "命運獵犬"
  },
  "thumb": "icons/curses/64/Fireball_Swarm.png"
}
