{
  "canAim": true,
  "castingDuration": 0.5,
  "chance": 1.0,
  "damage": 2.5,
  "delay": 0.5,
  "description": {
    "ar": "تطلق صاعقة نارية خارقة. عليك الضغط باستمرار والإفلات على العلامة لجعلها متفجرة.",
    "de": "Feuere einen durchdringenden Feuerbolzen ab. Halte die Taste gedrückt und lass sie beim Ziel los, um ihn explodieren zu lassen.",
    "en": "Shoot a piercing bolt of fire. Hold and release at the mark to make it explosive.",
    "es": "Dispara un rayo de fuego desgarrador. Mantén pulsado y suelta a la señal para convertirlo en explosivo.",
    "fr": "Tire un éclair de feu aveuglant. Maintenez et relâchez à la marque pour créer une explosion.",
    "fr-CA": "Tire un éclair de feu aveuglant. Maintenez et relâchez à la marque pour créer une explosion.",
    "it": "Lancia un dardo perforante di fuoco. Tieni premuto e rilascia sull'indicatore per farlo esplodere.",
    "ja": "炎の塊で敵を貫く。長押し後にタイミングよくボタンを離すと魔弾が爆発する。",
    "ko": "화염으로 된 꿰뚫는 화살을 하나 발사합니다. 표식에 대고 유지하다가 놓을 시 폭발시킬 수 있습니다.",
    "nl": "Deel een vurige klap uit. Houd vast om te richten en laat los op je doelwit om het te laten exploderen.",
    "pt-BR": "Dispare um raio de fogo perfurante. Segure e solte quando chegar na marca para torná-lo explosivo.",
    "ru": "Вы выпускаете огненный снаряд, проходящий сквозь врагов. Зажав кнопку и отпустив её на отметке, вы сделаете его взрывным.",
    "tr": "Deşip geçen bir ateş topu fırlatır. Ateş topunu patlatmak için hedefe göndermeden önce basılı tut.",
    "zh-CN": "射出一颗火球穿刺敌人。紧按后在标记处抓准时机放开，能让火球爆炸。",
    "zh-TW": "射出一顆火球穿刺敵人。在標記處投出，能讓火球爆炸。"
  },
  "descriptionPlain": {
    "ar": "تطلق صاعقة نارية خارقة. عليك الضغط باستمرار والإفلات على العلامة لجعلها متفجرة.",
    "de": "Feuere einen durchdringenden Feuerbolzen ab. Halte die Taste gedrückt und lass sie beim Ziel los, um ihn explodieren zu lassen.",
    "en": "Shoot a piercing bolt of fire. Hold and release at the mark to make it explosive.",
    "es": "Dispara un rayo de fuego desgarrador. Mantén pulsado y suelta a la señal para convertirlo en explosivo.",
    "fr": "Tire un éclair de feu aveuglant. Maintenez et relâchez à la marque pour créer une explosion.",
    "fr-CA": "Tire un éclair de feu aveuglant. Maintenez et relâchez à la marque pour créer une explosion.",
    "it": "Lancia un dardo perforante di fuoco. Tieni premuto e rilascia sull'indicatore per farlo esplodere.",
    "ja": "炎の塊で敵を貫く。長押し後にタイミングよくボタンを離すと魔弾が爆発する。",
    "ko": "화염으로 된 꿰뚫는 화살을 하나 발사합니다. 표식에 대고 유지하다가 놓을 시 폭발시킬 수 있습니다.",
    "nl": "Deel een vurige klap uit. Houd vast om te richten en laat los op je doelwit om het te laten exploderen.",
    "pt-BR": "Dispare um raio de fogo perfurante. Segure e solte quando chegar na marca para torná-lo explosivo.",
    "ru": "Вы выпускаете огненный снаряд, проходящий сквозь врагов. Зажав кнопку и отпустив её на отметке, вы сделаете его взрывным.",
    "tr": "Deşip geçen bir ateş topu fırlatır. Ateş topunu patlatmak için hedefe göndermeden önce basılı tut.",
    "zh-CN": "射出一颗火球穿刺敌人。紧按后在标记处抓准时机放开，能让火球爆炸。",
    "zh-TW": "射出一顆火球穿刺敵人。在標記處投出，能讓火球爆炸。"
  },
  "family": "Fireball",
  "icon": "icons/curses/Fireball.png",
  "id": "Fireball",
  "lore": {
    "ar": "تطلق ألسنة لهب العالم السفلي.",
    "de": "Entfessele die Flammen der Unterwelt.",
    "en": "Send forth the flames of the Underworld.",
    "es": "Lanza hacia delante las llamas del Inframundo.",
    "fr": "Invoque les flammes des enfers.",
    "fr-CA": "Invoque les flammes des enfers.",
    "it": "Fai divampare le fiamme degli Inferi.",
    "ja": "冥界の炎を射出せよ。",
    "ko": "저승의 화염을 앞으로 발사한다.",
    "nl": "Wakker de vlammen van de onderwereld aan.",
    "pt-BR": "Invoque as chamas do Submundo.",
    "ru": "Пламя мира мёртвых очистит мир смертных.",
    "tr": "Cehennem ateşlerine hükmet.",
    "zh-CN": "放射出冥界的火焰。",
    "zh-TW": "放射出冥界的火焰。"
  },
  "name": {
    "ar": "الطلقة المشتعلة",
    "de": "Flammenschuss",
    "en": "Flaming Shot",
    "es": "Disparo flameante",
    "fr": "Tir de feu",
    "fr-CA": "Tir de feu",
    "it": "Colpo infuocato",
    "ja": "炎の魔弾",
    "ko": "불타는 사격",
    "nl": "Vlammend schot",
    "pt-BR": "Tiro Flamejante",
    "ru": "Пылающий выстрел",
    "tr": "Ateş Topu",
    "zh-CN": "烈焰弹",
    "zh-TW": "烈焰彈"
  },
  "namePlain": {
    "ar": "الطلقة المشتعلة",
    "de": "Flammenschuss",
    "en": "Flaming Shot",
    "es": "Disparo flameante",
    "fr": "Tir de feu",
    "fr-CA": "Tir de feu",
    "it": "Colpo infuocato",
    "ja": "炎の魔弾",
    "ko": "불타는 사격",
    "nl": "Vlammend schot",
    "pt-BR": "Tiro Flamejante",
    "ru": "Пылающий выстрел",
    "tr": "Ateş Topu",
    "zh-CN": "烈焰弹",
    "zh-TW": "烈焰彈"
  },
  "thumb": "icons/curses/64/Fireball.png"
}
