{
  "canAim": true,
  "castingDuration": 0.5,
  "chance": 1.0,
  "damage": 1.5,
  "delay": 0.5,
  "description": {
    "ar": "ثوران من أعمدة ثلجية <color=#70F7FF>تجمد</color> الأعداء عند تلقي ضربة.",
    "de": "Hervorbrechende Eissäulen, die getroffene Gegner <color=#70F7FF>einfrieren</color>.",
    "en": "An eruption of ice pillars that <color=#70F7FF>freezes</color> enemies on hit.",
    "es": "Una erupción de pilares de hielo que <color=#70F7FF>congelan</color> a los enemigos que golpeen.",
    "fr": "Des piliers de glace qui <color=#70F7FF>gèlent</color> les ennemis.",
    "fr-CA": "Des piliers de glace qui <color=#70F7FF>gèlent</color> les ennemis.",
    "it": "Un'eruzione di stalattiti che <color=#70F7FF>congelano</color> i nemici al tocco.",
    "ja": "氷の柱を地面から召喚し、命中した敵を<color=#70F7FF>凍結</color>させる。",
    "ko": "적들을 맞출 시 <color=#70F7FF>얼려버리는</color> 얼음 기둥을 분출시킵니다.",
    "nl": "Een uitbarsting van ijspilaren die vijanden <color=#70F7FF>bevriest</color> wanneer je ze raakt.",
    "pt-BR": "Uma erupção de pilares de gelo que <color=#70F7FF>congela</color> os inimigos ao acertá-los.",
    "ru": "Вы поднимаете из земли ледяные глыбы, которые <color=#70F7FF>замораживают</color> задетых врагов.",
    "tr": "Düşmanları isabet hâlinde <color=#70F7FF>donduran</color> bir buz sütunu patlaması.",
    "zh-CN": "猛烈迸发出冰柱，击中敌人时<color=#70F7FF>冻结</color>敌人",
    "zh-TW": "猛烈迸發出冰柱，擊中敵人時<color=#70F7FF>凍結</color>敵人"
  },
  "descriptionPlain": {
    "ar": "ثوران من أعمدة ثلجية تجمد الأعداء عند تلقي ضربة.",
    "de": "Hervorbrechende Eissäulen, die getroffene Gegner einfrieren.",
    "en": "An eruption of ice pillars that freezes enemies on hit.",
    "es": "Una erupción de pilares de hielo que congelan a los enemigos que golpeen.",
    "fr": "Des piliers de glace qui gèlent les ennemis.",
    "fr-CA": "Des piliers de glace qui gèlent les ennemis.",
    "it": "Un'eruzione di stalattiti che congelano i nemici al tocco.",
    "ja": "氷の柱を地面から召喚し、命中した敵を凍結させる。",
    "ko": "적들을 맞출 시 얼려버리는 얼음 기둥을 분출시킵니다.",
    "nl": "Een uitbarsting van ijspilaren die vijanden bevriest wanneer je ze raakt.",
    "pt-BR": "Uma erupção de pilares de gelo que congela os inimigos ao acertá-los.",
    "ru": "Вы поднимаете из земли ледяные глыбы, которые замораживают задетых врагов.",
    "tr": "Düşmanları isabet hâlinde donduran bir buz sütunu patlaması.",
    "zh-CN": "猛烈迸发出冰柱，击中敌人时冻结敌人",
    "zh-TW": "猛烈迸發出冰柱，擊中敵人時凍結敵人"
  },
  "family": "Tentacles",
  "icon": "icons/curses/Tentacles_Ice.png",
  "id": "Tentacles_Ice",
  "lore": {
    "ar": "نداء من العالم السفلي ببدء العام الشتوي.",
    "de": "Ein Ruf aus der Tiefe, mit dem das Winterjahr begann.",
    "en": "A call from below that began the Winter Year.",
    "es": "Una llamada de las profundidades que da comienzo al año invernal.",
    "fr": "Un appel des enfers qui créa l'année hivernale.",
    "fr-CA": "Un appel des enfers qui amorça l'année hivernale.",
    "it": "Un appello dalle profondità che diede inizio all'Anno glaciale.",
    "ja": "地中からのその呼び声は、氷河期の幕開けをもたらした。",
    "ko": "겨울을 시작하게 한 아래에서의 부름이다.",
    "nl": "Een kreet van onder de aarde waarmee het winterjaar begon.",
    "pt-BR": "Um chamado lá de baixo que dá início ao Ano de Inverno.",
    "ru": "Зов из глубин дал начало году снегов.",
    "tr": "Yer altından gelen, Kış Yılı'nı başlatan çağrı.",
    "zh-CN": "开启严冬之年的下界呼唤。",
    "zh-TW": "開啟嚴冬之年的下界呼喚。"
  },
  "name": {
    "ar": "لمسة وحش الجليد",
    "de": "Ithaquas Berührung",
    "en": "Touch of Ithaqua",
    "es": "Toque de Ithaqua",
    "fr": "Souvenir d'Itaqua",
    "fr-CA": "Souvenir d'Itaqua",
    "it": "Tocco di Ithaqua",
    "ja": "イタクァの御手",
    "ko": "이타콰의 손길",
    "nl": "Aanraking van Ithaqua",
    "pt-BR": "Toque de Ithaqua",
    "ru": "Касание Итакуа",
    "tr": "Ithaqua'nın Dokunuşu",
    "zh-CN": "伊塔库亚之触",
    "zh-TW": "伊塔庫亞之觸"
  },
  "namePlain": {
    "ar": "لمسة وحش الجليد",
    "de": "Ithaquas Berührung",
    "en": "Touch of Ithaqua",
    "es": "Toque de Ithaqua",
    "fr": "Souvenir d'Itaqua",
    "fr-CA": "Souvenir d'Itaqua",
    "it": "Tocco di Ithaqua",
    "ja": "イタクァの御手",
    "ko": "이타콰의 손길",
    "nl": "Aanraking van Ithaqua",
    "pt-BR": "Toque de Ithaqua",
    "ru": "Касание Итакуа",
    "tr": "Ithaqua'nın Dokunuşu",
    "zh-CN": "伊塔库亚之触",
    "zh-TW": "伊塔庫亞之觸"
  },
  "thumb": "icons/curses/64/Tentacles_Ice.png"
}
