{
  "canAim": true,
  "castingDuration": 0.5,
  "chance": 1.0,
  "damage": 2.0,
  "delay": 0.5,
  "description": {
    "ar": "تطلق ثلاث قذائف دفعة واحدة.",
    "de": "Verschießt drei Projektile gleichzeitig.",
    "en": "Shoots three projectiles at once.",
    "es": "Dispara tres proyectiles a la vez.",
    "fr": "Tire trois projectiles à la fois.",
    "fr-CA": "Tire trois projectiles à la fois.",
    "it": "Spara tre proiettili contemporaneamente.",
    "ja": "1度に3つの弾を射出する。",
    "ko": "한 번에 세 개의 투사체를 발사합니다.",
    "nl": "Schiet tegelijk drie projectielen af.",
    "pt-BR": "Dispara três projéteis de uma vez só.",
    "ru": "Вы выпускаете три снаряда за раз.",
    "tr": "Aynı anda üç menzilli saldırı yapar.",
    "zh-CN": "一次射出三个投射物。",
    "zh-TW": "一次射出三個投射物。"
  },
  "descriptionPlain": {
    "ar": "تطلق ثلاث قذائف دفعة واحدة.",
    "de": "Verschießt drei Projektile gleichzeitig.",
    "en": "Shoots three projectiles at once.",
    "es": "Dispara tres proyectiles a la vez.",
    "fr": "Tire trois projectiles à la fois.",
    "fr-CA": "Tire trois projectiles à la fois.",
    "it": "Spara tre proiettili contemporaneamente.",
    "ja": "1度に3つの弾を射出する。",
    "ko": "한 번에 세 개의 투사체를 발사합니다.",
    "nl": "Schiet tegelijk drie projectielen af.",
    "pt-BR": "Dispara três projéteis de uma vez só.",
    "ru": "Вы выпускаете три снаряда за раз.",
    "tr": "Aynı anda üç menzilli saldırı yapar.",
    "zh-CN": "一次射出三个投射物。",
    "zh-TW": "一次射出三個投射物。"
  },
  "family": "Fireball",
  "icon": "icons/curses/Fireball_Triple.png",
  "id": "Fireball_Triple",
  "lore": {
    "ar": "ألسنة لهب مطهرة تشتعل بقوة حارقة ثلاثية.",
    "de": "Die Flammen der Reinigung brennen dreimal so hell.",
    "en": "Flames of cleansing burn thrice as bright.",
    "es": "Las llamas del fuego purificador brillan tres veces más.",
    "fr": "Les flammes de la purification brûlent trois fois plus fort.",
    "fr-CA": "Les flammes de la purification brûlent trois fois plus fort.",
    "it": "Le fiamme della purificazione bruciano tre volte più intensamente.",
    "ja": "清め浄化する炎、その輝きの強さは3倍だという。",
    "ko": "정화의 불길이 세 번 밝게 불탄다.",
    "nl": "Louterende vlammen branden drie keer zo fel.",
    "pt-BR": "Chamas purificadoras são três vezes mais brilhantes.",
    "ru": "Очищающее пламя полыхает ярче.",
    "tr": "Arındıran alevlerin kör edici parlaklığına şahit ol.",
    "zh-CN": "净化烈火的火光亮上三倍。",
    "zh-TW": "淨化烈焰燃燒的火光亮上三倍。"
  },
  "name": {
    "ar": "نار التطهير",
    "de": "Reinigendes Feuer",
    "en": "Cleansing Fire",
    "es": "Fuego purificador",
    "fr": "Feu purificateur",
    "fr-CA": "Feu purificateur",
    "it": "Fuoco purificatore",
    "ja": "浄化の炎",
    "ko": "정화의 불길",
    "nl": "Louterend vuur",
    "pt-BR": "Fogo Purificador",
    "ru": "Очищающий огонь",
    "tr": "Arındıran Ateş",
    "zh-CN": "净化烈火",
    "zh-TW": "淨化烈火"
  },
  "namePlain": {
    "ar": "نار التطهير",
    "de": "Reinigendes Feuer",
    "en": "Cleansing Fire",
    "es": "Fuego purificador",
    "fr": "Feu purificateur",
    "fr-CA": "Feu purificateur",
    "it": "Fuoco purificatore",
    "ja": "浄化の炎",
    "ko": "정화의 불길",
    "nl": "Louterend vuur",
    "pt-BR": "Fogo Purificador",
    "ru": "Очищающий огонь",
    "tr": "Arındıran Ateş",
    "zh-CN": "净化烈火",
    "zh-TW": "淨化烈火"
  },
  "thumb": "icons/curses/64/Fireball_Triple.png"
}
