{
  "canAim": false,
  "castingDuration": 0.5,
  "chance": 1.0,
  "damage": 1.5,
  "delay": 0.5,
  "description": {
    "ar": "تطيح بالأعداء داخل نطاقك ويلحق بهم الضرر أيضًا.",
    "de": "Wirft Gegner in deiner Reichweite zurück und fügt ihnen gleichzeitig Schaden zu.",
    "en": "Knocks back enemies within your range while also damaging them.",
    "es": "Daña a los enemigos dentro de su alcance y los hace retroceder.",
    "fr": "Repousse et blesse les ennemis à portée.",
    "fr-CA": "Repousse et blesse les ennemis à portée.",
    "it": "Respinge e danneggia i nemici nel raggio d'azione.",
    "ja": "範囲内の敵をノックバックしダメージを与える。",
    "ko": "범위 내에 있는 적들을 밀쳐냄과 동시에 피해를 줍니다.",
    "nl": "Slaat vijanden binnen je bereik terug en verwondt ze.",
    "pt-BR": "Empurra os inimigos ao seu alcance para trás e causa dano a eles.",
    "ru": "Вы отбрасываете врагов, нанося урон.",
    "tr": "Menzilindeki düşmanları geri savurur ve onlara hasar verir.",
    "zh-CN": "击退范围内的敌人，同时造成伤害。",
    "zh-TW": "擊退範圍內的敵人，同時造成傷害。"
  },
  "descriptionPlain": {
    "ar": "تطيح بالأعداء داخل نطاقك ويلحق بهم الضرر أيضًا.",
    "de": "Wirft Gegner in deiner Reichweite zurück und fügt ihnen gleichzeitig Schaden zu.",
    "en": "Knocks back enemies within your range while also damaging them.",
    "es": "Daña a los enemigos dentro de su alcance y los hace retroceder.",
    "fr": "Repousse et blesse les ennemis à portée.",
    "fr-CA": "Repousse et blesse les ennemis à portée.",
    "it": "Respinge e danneggia i nemici nel raggio d'azione.",
    "ja": "範囲内の敵をノックバックしダメージを与える。",
    "ko": "범위 내에 있는 적들을 밀쳐냄과 동시에 피해를 줍니다.",
    "nl": "Slaat vijanden binnen je bereik terug en verwondt ze.",
    "pt-BR": "Empurra os inimigos ao seu alcance para trás e causa dano a eles.",
    "ru": "Вы отбрасываете врагов, нанося урон.",
    "tr": "Menzilindeki düşmanları geri savurur ve onlara hasar verir.",
    "zh-CN": "击退范围内的敌人，同时造成伤害。",
    "zh-TW": "擊退範圍內的敵人，同時造成傷害。"
  },
  "family": "EnemyBlast",
  "icon": "icons/curses/EnemyBlast.png",
  "id": "EnemyBlast",
  "lore": {
    "ar": "لعنة ضد غير الجديرين بوجودك.",
    "de": "Verflucht alle, die deiner Gegenwart unwürdig sind.",
    "en": "A curse against those unworthy of your presence.",
    "es": "Una maldición contra los indignos de tu presencia.",
    "fr": "Maléfice pour les êtres indignes de votre présence.",
    "fr-CA": "Maléfice pour les êtres indignes de votre présence.",
    "it": "Sia maledetto chi non è degno della tua presenza.",
    "ja": "敵とみなした者どもに対抗するための呪い。",
    "ko": "당신의 존재에 걸맞지 않은 자들에게 내리는 저주이다.",
    "nl": "Een vloek tegen hen die je niet waardig zijn.",
    "pt-BR": "Uma maldição para aqueles indignos de sua presença.",
    "ru": "Проклятие для тех, кто недостоин быть рядом с вами.",
    "tr": "Senin huzuruna çıkmaya layık olmayanlara karşı bir lanet.",
    "zh-CN": "咒术之一，攻击不配出现在你眼前的敌人。",
    "zh-TW": "咒術之一，攻擊不配出現在你眼前的敵人。"
  },
  "name": {
    "ar": "الانفجار المقدر",
    "de": "Göttliche Explosion",
    "en": "Divine Blast",
    "es": "Explosión divina",
    "fr": "Rafale divine",
    "fr-CA": "Rafale divine",
    "it": "Esplosione divina",
    "ja": "神聖なる波動",
    "ko": "신성한 일격",
    "nl": "Goddelijke klap",
    "pt-BR": "Explosão Divina",
    "ru": "Божественный взрыв",
    "tr": "İlahi İnfilak",
    "zh-CN": "神圣爆炸",
    "zh-TW": "神聖爆炸"
  },
  "namePlain": {
    "ar": "الانفجار المقدر",
    "de": "Göttliche Explosion",
    "en": "Divine Blast",
    "es": "Explosión divina",
    "fr": "Rafale divine",
    "fr-CA": "Rafale divine",
    "it": "Esplosione divina",
    "ja": "神聖なる波動",
    "ko": "신성한 일격",
    "nl": "Goddelijke klap",
    "pt-BR": "Explosão Divina",
    "ru": "Божественный взрыв",
    "tr": "İlahi İnfilak",
    "zh-CN": "神圣爆炸",
    "zh-TW": "神聖爆炸"
  },
  "thumb": "icons/curses/64/EnemyBlast.png"
}
