{
  "canAim": false,
  "castingDuration": 0.5,
  "chance": 1.0,
  "damage": 1.5,
  "delay": 0.5,
  "description": {
    "ar": "تطيح بالأعداء وتسممهم.",
    "de": "Wirft Gegner zurück und vergiftet sie.",
    "en": "Knocks back and poisons enemies.",
    "es": "Empuja y envenena a los enemigos.",
    "fr": "Repousse et empoisonne les ennemis.",
    "fr-CA": "Repousse et empoisonne les ennemis.",
    "it": "Respinge e avvelena i nemici.",
    "ja": "敵をノックバックし、毒を付与する。",
    "ko": "적들을 밀치고 중독시킵니다.",
    "nl": "Slaat vijanden terug en vergiftigt ze.",
    "pt-BR": "Empurra e envenena os inimigos.",
    "ru": "Вы отбрасываете врагов, отравляя их.",
    "tr": "Düşmanları geri savurur ve zehirler.",
    "zh-CN": "击退敌人并使其中毒。",
    "zh-TW": "擊退敵人並使其中毒。"
  },
  "descriptionPlain": {
    "ar": "تطيح بالأعداء وتسممهم.",
    "de": "Wirft Gegner zurück und vergiftet sie.",
    "en": "Knocks back and poisons enemies.",
    "es": "Empuja y envenena a los enemigos.",
    "fr": "Repousse et empoisonne les ennemis.",
    "fr-CA": "Repousse et empoisonne les ennemis.",
    "it": "Respinge e avvelena i nemici.",
    "ja": "敵をノックバックし、毒を付与する。",
    "ko": "적들을 밀치고 중독시킵니다.",
    "nl": "Slaat vijanden terug en vergiftigt ze.",
    "pt-BR": "Empurra e envenena os inimigos.",
    "ru": "Вы отбрасываете врагов, отравляя их.",
    "tr": "Düşmanları geri savurur ve zehirler.",
    "zh-CN": "击退敌人并使其中毒。",
    "zh-TW": "擊退敵人並使其中毒。"
  },
  "family": "EnemyBlast",
  "icon": "icons/curses/EnemyBlast_Poison.png",
  "id": "EnemyBlast_Poison",
  "lore": {
    "ar": "تنذر بسوء الطالع.",
    "de": "Das Omen eines großen Unglücks.",
    "en": "Omen of great ill fortune.",
    "es": "Un mal augurio.",
    "fr": "Présage d'un grand malheur.",
    "fr-CA": "Présage d'un grand malheur.",
    "it": "Presagio di grande sfortuna.",
    "ja": "大いなる不運の前触れ。",
    "ko": "커다란 불행의 징조다.",
    "nl": "Voorbode van grote rampspoed.",
    "pt-BR": "Um presságio de grande infortúnio.",
    "ru": "Предвестие ещё большей беды.",
    "tr": "Makus kaderin alameti.",
    "zh-CN": "恐怖厄运的预兆。",
    "zh-TW": "恐怖厄運的預兆。"
  },
  "name": {
    "ar": "البلاء المقدر",
    "de": "Göttliche Pest",
    "en": "Divine Blight",
    "es": "Plaga divina",
    "fr": "Châtiment sacré",
    "fr-CA": "Châtiment sacré",
    "it": "Flagello divino",
    "ja": "神聖なる毒風",
    "ko": "신성한 역병",
    "nl": "Goddelijk verderf",
    "pt-BR": "Flagelo Divino",
    "ru": "Божественный мор",
    "tr": "İlahi Mahvoluş",
    "zh-CN": "神圣毒祸",
    "zh-TW": "神聖毒禍"
  },
  "namePlain": {
    "ar": "البلاء المقدر",
    "de": "Göttliche Pest",
    "en": "Divine Blight",
    "es": "Plaga divina",
    "fr": "Châtiment sacré",
    "fr-CA": "Châtiment sacré",
    "it": "Flagello divino",
    "ja": "神聖なる毒風",
    "ko": "신성한 역병",
    "nl": "Goddelijk verderf",
    "pt-BR": "Flagelo Divino",
    "ru": "Божественный мор",
    "tr": "İlahi Mahvoluş",
    "zh-CN": "神圣毒祸",
    "zh-TW": "神聖毒禍"
  },
  "thumb": "icons/curses/64/EnemyBlast_Poison.png"
}
